layer,id,name,fileName,color,rarity,adjustedRarity,description
"","1","Crown","08_cleric_crown_r02.png","crown","2","1","Gem-studded crown used by high priests for ancient rituals, heightening their already impressive powers"
"","2","Cap","08_floating_bonet_r09.png","bonet","9","4.5","Somehow lighter than a feather, the magical stones used in this cap make you feel constantly energized"
"","3","Dark Helmet","08_helmet_dark_r09.png","dark","9","4.5","Battle-tested helmet that invokes fear in their opponents"
"","4","Draconic Helmet","08_helmet_draconic_r09.png","draconic","9","4.5","Battle-tested helmet that invokes fear in their opponents"
"","5","Golden Helmet","08_helmet_golden_r09.png","golden","9","4.5","Battle-tested helmet that invokes fear in their opponents"
"","6","Headdress","08_sun_headset_r02.png","headset","2","1","A tribute to the life-giving sun, this heavy helmet is mostly worn by high priests at harvest festivals"
"","7","Blue Mage Hat","08_wizardhat_blue_r05.png","blue","5","2.5","Woven by the owner's magic, it imbues a fragment of the Wizard's soul. Blue represents its creator's depth of knowledge"
"","8","Red Mage Hat","08_wizardhat_red_r05.png","red","5","2.5","Woven by the owner's magic, it imbues a fragment of the Wizard's soul. Red represents its creator's passion"
"","9","White Mage Hat","08_wizardhat_white_r05.png","white","5","2.5","Woven by the owner's magic, it imbues a fragment of the Wizard's soul. White represents its creator's power over others"
"","10","Yellow Mage Hat","08_wizardhat_yellow_r05.png","yellow","5","2.5","Woven by the owner's magic, it imbues a fragment of the Wizard's soul. Yellow represents its creator's ambition"
"","0","none","none","none","76","76","No need for eyewear, adventure is afoot"
"","1","3D Glasses","09_3D glasses_r01.png","","1","1","Little is known about its origins, it is said to make visuals come to life"
"","2","Draconic Mask","09_draconic_mask_r08.png","mask","8","8","Worn for feasts and revelrie, or tricksters looking to give nothing away"
"","3","Eye Patch","09_eye_patch_r05.png","patch","5","5","Many elves use eyepatches to attune their vision to darkness. Some say it also improves their luck"
"","4","Ki Sensor","09_ki sensor_r02.png","","2","2","The latest research and innovation allows the wearer to ascertain another’s power level"
"","5","Pointeau Mask","09_pointeau mask_r08.png","","8","8","Privacy is an utmost priority for all, even those who have nothing to hide"
"","0","none","none","none","88","88",""
"","1","Dark Battle Mask","10_air mask_dark_r05.png","dark","5","1.1320754716981132","Battle mask covering the wearer's mouth, it enhances oxygen intake and fearsomeness"
"","2","Draconic Battle Mask","10_air mask_draconic_r10.png","draconic","10","2.2641509433962264","Battle mask covering the wearer's mouth, it enhances oxygen intake and fearsomeness"
"","3","Golden Battle Mask","10_air mask_golden_r05.png","golden","5","1.1320754716981132","Battle mask covering the wearer's mouth, it enhances oxygen intake and fearsomeness"
"","4","Golden Veil","10_chain_veil_r03.png","veil","3","0.6792452830188679","Luxurious veil worn in celebratory fashion, each golden strand represents their wearer's lineage"
"","5","Earrings","10_earping_r03.png","","8","0.6792452830188679","A subdued style, only an astute eye will notice these earrings are adorned with the rarest gems"
"","6","Golden Earrings","10_earring_r08.png","","3","1.8113207547169812","Studded with golden gems, these earrings make a bold statement "
"","7","Necklace","10_necklace_r08.png","","8","1.8113207547169812","A necklace worn by the attendants of court while plotting political plays"
"","8","Air Filter","10_nose air_dark_r03.png","dark","3","0.6792452830188679","Enhanced oxygen filtration conveys a distinct advantage on the battlefield"
"","9","Air Filter","10_nose air_white_r08.png","white","8","1.8113207547169812","Enhanced oxygen filtration conveys a distinct advantage on the battlefield"
